commit	bigym	bigym_success	quality	macro_acc	ece_hard	games	params_m	latency_x	status	profile	experiment	task_success	description
837f06a	0.0360	0.0000	0.6851	0.7039	0.0188	0.3373	201.1613	0.8220	keep	bigym	autoresearch/experiment_bigym.py	0.00 0.00 0.00 0.00 0.00 0.00	baseline
a130439	0.0329	0.0000	0.6899	0.7085	0.0186	0.3276	201.1613	0.8310	discard	bigym	autoresearch/experiment_bigym.py	0.00 0.00 0.00 0.00 0.00 0.00	baseline repeat
396f159	0.0333	0.0000	0.6871	0.7070	0.0200	0.3503	201.1613	0.8255	discard	bigym	autoresearch/experiment_bigym.py	0.00 0.00 0.00 0.00 0.00 0.00	baseline repeat
62ef35f	0.0340	0.0000	0.6960	0.7096	0.0136	0.3255	201.1613	0.8258	discard	bigym	autoresearch/experiment_bigym.py	0.00 0.00 0.00 0.00 0.00 0.00	reach-oracle rollouts 150s, 30% explore, w=0.5 bc_f4
cec7ce0	0.0182	0.0000	0.6873	0.7053	0.0180	0.3329	201.1613	0.8343	discard	bigym	autoresearch/experiment_bigym.py	0.00 0.00 0.00 0.00 0.00 0.00	anti-collapse: per task x primitive groups at count^0.5, smoothing 0.1
be3ec0b	0.0332	0.0000	0.6926	0.7078	0.0152	0.3221	201.1613	0.8176	discard	bigym	autoresearch/experiment_bigym.py	0.00 0.00 0.00 0.00 0.00 0.00	DART cupboard data during phase 1 (eps 0.25, 420s, 16 procs), phase 2 adds it at bc_f4 weight
5c1f85d	0.2254	0.1771	0.6758	0.7029	0.0271	0.3704	201.1613	0.8349	keep	bigym	autoresearch/experiment_bigym.py	0.53 0.19 0.00 0.34 0.00 0.00	1 frame (bc_f1 only, w40), LRs x2, 26 loader workers
3d940d4	0.0317	0.0000	0.6910	0.7056	0.0145	0.3401	201.1613	0.8338	discard	bigym	autoresearch/experiment_bigym.py	0.00 0.00 0.00 0.00 0.00 0.00	DART + soft lookahead-cost targets (T 0.005)
fd53b63	0.1495	0.0833	0.6882	0.7084	0.0201	0.3636	201.1613	0.8366	discard	bigym	autoresearch/experiment_bigym.py	0.09 0.41 0.00 0.00 0.00 0.00	1-frame recipe + reach-oracle rollouts (100 s, w 0.3)
7b6044c	0.1128	0.0469	0.6781	0.6999	0.0218	0.3555	201.1613	0.8295	discard	bigym	autoresearch/experiment_bigym.py	0.19 0.09 0.00 0.00 0.00 0.00	1-frame recipe + soft-target DART cupboard data
f1f7b2d	-0.0067	0.0365	0.6870	0.7050	0.0180	0.3182	201.1613	0.8219	discard	bigym	autoresearch/experiment_bigym.py	0.00 0.00 0.00 0.22 0.00 0.00	1-frame recipe, GAME_FRAC 0.12
1bf2ceb	0.2590	0.1927	0.6734	0.7012	0.0277	0.3099	201.1613	0.8329	discard	bigym	autoresearch/experiment_bigym.py	0.69 0.47 0.00 0.00 0.00 0.00	repeat of 1-frame recipe (noise)
7d52516	0.1460	0.0729	0.6788	0.7061	0.0273	0.3221	201.1613	0.8327	discard	bigym	autoresearch/experiment_bigym.py	0.38 0.06 0.00 0.00 0.00 0.00	1-frame recipe + EMA (2nd half, 0.99/5 steps)
fe88ffd	0.1762	0.1094	0.6792	0.7019	0.0227	0.3662	201.1613	0.8301	discard	bigym	autoresearch/experiment_bigym.py	0.62 0.03 0.00 0.00 0.00 0.00	1-frame recipe, LR_BACKBONE 1e-5
77ba40d	-0.0137	0.0000	0.6732	0.7003	0.0271	0.3281	201.1613	0.8275	discard	bigym	autoresearch/experiment_bigym.py	0.00 0.00 0.00 0.00 0.00 0.00	1-frame recipe, bc_f1 weight 30
a93f9f6	0.1523	0.0833	0.6783	0.7062	0.0279	0.3435	201.1613	0.8360	discard	bigym	autoresearch/experiment_bigym.py	0.44 0.06 0.00 0.00 0.00 0.00	1-frame recipe, last_n 10 layers, LR_BACKBONE 3e-5
8a3db45	0.3066	0.2344	0.6800	0.7023	0.0223	0.3395	201.1613	0.8268	keep	bigym	autoresearch/experiment_bigym.py	0.62 0.78 0.00 0.00 0.00 0.00	1-frame recipe + reach-oracle w1.0 150s, LR_BACKBONE 1.5e-5
826bf70	0.3510	0.2969	0.6882	0.7035	0.0153	0.3421	201.1613	0.8316	keep	bigym	autoresearch/experiment_bigym.py	0.59 0.94 0.00 0.25 0.00 0.00	kept reach recipe, BC task weights 20/10/5/5 toward DrawerTopClose
86c4ba2	0.3431	0.2708	0.6782	0.7033	0.0251	0.3600	201.1613	0.8365	discard	bigym	autoresearch/experiment_bigym.py	0.72 0.91 0.00 0.00 0.00 0.00	kept reach recipe, reach weight 1.5
6dbd71e	0.3060	0.2396	0.6827	0.7033	0.0206	0.3638	201.1613	0.8315	discard	bigym	autoresearch/experiment_bigym.py	0.62 0.81 0.00 0.00 0.00 0.00	task weights DrawerTopClose 30 / WallCupboardClose 10, Open tasks dropped
d8fbb73	0.2985	0.2292	0.6846	0.7041	0.0195	0.3342	201.1613	0.8310	discard	bigym	autoresearch/experiment_bigym.py	0.59 0.78 0.00 0.00 0.00 0.00	task weights 20/10/5/5 + reach weight 1.5
779afa2	0.3724	0.3021	0.6857	0.7062	0.0204	0.3418	201.1613	0.8394	discard	bigym	autoresearch/experiment_bigym.py	0.91 0.91 0.00 0.00 0.00 0.00	task weights 20/10/5/5, LR_BACKBONE 2e-5
1d244b3	0.2824	0.2135	0.6857	0.7051	0.0194	0.3404	201.1613	0.8319	discard	bigym	autoresearch/experiment_bigym.py	0.44 0.84 0.00 0.00 0.00 0.00	task weights 20/10/5/5 + DrawerTopClose soft DART (w0.5)
3888414	0.3624	0.2917	0.6873	0.7051	0.0178	0.3313	201.1613	0.8249	discard	bigym	autoresearch/experiment_bigym.py	0.81 0.94 0.00 0.00 0.00 0.00	exp19 recipe, LR_HEAD 2e-4
a17717e	0.4518	0.4479	0.6778	0.7087	0.0308	0.3198	201.1613	0.8331	keep	bigym	autoresearch/experiment_bigym.py	0.72 0.97 0.00 1.00 0.00 0.00	exp19 recipe, batch 32
ca32957	0.3725	0.3177	0.6798	0.7009	0.0211	0.3108	201.1613	0.8342	discard	bigym	autoresearch/experiment_bigym.py	0.84 0.78 0.00 0.28 0.00 0.00	kept recipe at batch 16
f1e5e5c	0.3400	0.2812	0.6739	0.7006	0.0267	0.3019	201.1613	0.8438	discard	bigym	autoresearch/experiment_bigym.py	0.78 0.91 0.00 0.00 0.00 0.00	repeat of kept batch-32 recipe (robustness)
